{
    "$schema": "https://raw.githubusercontent.com/azure/azure-sdk-tools/main/tools/secret-management/schema/1.0.0/access.json",
    "identityName": "access-manager-fed-cred-only-test",
    "subscriptionId": "00000000-0000-0000-0000-000000000000",
    "resourceGroup": "rg-testfoobaraccessmanager",
    "location": "eastus",
    "federatedIdentityCredentials": [
        {
          "audiences": [
            "api://azureadtokenexchange"
          ],
          "description": "event processor oidc main tools",
          "issuer": "https://token.actions.githubusercontent.com",
          "name": "githubactionscredential-tools-main-test1",
          "subject": "repo:testfoobaraccessmanager/azure-sdk-tools:ref:refs/heads/main"
        },
        {
          "audiences": [
            "api://azureadtokenexchange"
          ],
          "description": "event processor oidc main net",
          "issuer": "https://token.actions.githubusercontent.com",
          "name": "githubactionscredential-net-main-test1",
          "subject": "repo:testfoobaraccessmanager/azure-sdk-for-net:ref:refs/heads/main"
        }
    ]
}