{
    "$schema": "https://raw.githubusercontent.com/azure/azure-sdk-tools/main/tools/secret-management/schema/1.0.0/access.json",
    "identityName": "access-manager-test",
    "subscriptionId": "00000000-0000-0000-0000-000000000000",
    "resourceGroup": "rg-testfoobaraccessmanager",
    "location": "eastus",
    "properties": {
        "subscriptionId": "00000000-0000-0000-0000-000000000000",
        "resourceGroup": "rg-testfoobaraccessmanager",
        "commonScope": "ref:refs/heads/main"
    },
    "roleBasedAccessControls": [
        {
          "role": "Contributor",
          "scope": "/subscriptions/{{ subscriptionId }}/resourceGroups/{{ resourceGroup }}"
        },
        {
          "role": "Key Vault Secrets User",
          "scope": "/subscriptions/{{ subscriptionId }}/resourceGroups/{{ resourceGroup }}/providers/Microsoft.KeyVault/vaults/testfoobaraccessmanager"
        }
    ],
    "federatedIdentityCredentials": [
        {
          "audiences": [
            "api://azureadtokenexchange"
          ],
          "description": "event processor oidc main tools",
          "issuer": "https://token.actions.githubusercontent.com",
          "name": "githubactionscredential-tools-main-test1",
          "subject": "repo:testfoobaraccessmanager/azure-sdk-tools:{{ commonScope }}"
        },
        {
          "audiences": [
            "api://azureadtokenexchange"
          ],
          "description": "event processor oidc main net",
          "issuer": "https://token.actions.githubusercontent.com",
          "name": "githubactionscredential-net-main-test1",
          "subject": "repo:testfoobaraccessmanager/azure-sdk-for-net:{{ commonScope }}"
        },
        {
          "audiences": [
            "api://azureadtokenexchange"
          ],
          "description": "event processor oidc main go",
          "issuer": "https://token.actions.githubusercontent.com",
          "name": "githubactionscredential-net-go-test1",
          "subject": "repo:testfoobaraccessmanager/azure-sdk-for-go:{{ commonScope }}"
        }
    ]
}